Festival Name,Type,State,Month/Season,Description
Durga Puja,State,West Bengal,September-October,"Durga Puja is the most significant festival in West Bengal, celebrating the victory of Goddess Durga over the demon Mahishasura. This five-day festival transforms the entire state into a grand celebration with elaborately decorated pandals (temporary structures) housing artistic clay idols of Goddess Durga. Each pandal represents a unique theme, showcasing creativity and artistic excellence. The celebration includes traditional drumbeats of dhak, dhunuchi dance with incense burners, and cultural programs featuring dance, music, and theater. People wear new clothes and participate in pandal hopping, visiting various installations. The festival concludes with the visarjan (immersion) ceremony where idols are taken in grand processions to rivers. Durga Puja represents the triumph of good over evil and showcases Bengali culture and artistry."
Hemis Festival,State,Jammu & Kashmir,June-July,"Hemis Festival is the largest and most famous monastic festival in Ladakh, held at the historic Hemis Monastery to commemorate the birth anniversary of Guru Padmasambhava, the founder of Tibetan Buddhism. This two-day festival features spectacular mask dances called Cham performed by monks wearing colorful silk robes and elaborate masks representing various deities and demons. The dances symbolize the victory of good over evil and are accompanied by traditional music played on long horns, cymbals, and drums. The festival includes the display of a massive thangka (sacred painting) that is unrolled once every twelve years. Visitors can witness traditional Ladakhi culture, taste local cuisine like thukpa and chang, and experience the spiritual atmosphere of the high-altitude desert monastery."
Bonalu,State,Andhra Pradesh,July-August,"Bonalu is a traditional Hindu festival celebrated in Telangana and parts of Andhra Pradesh, dedicated to Goddess Mahakali. The festival involves women carrying decorated pots (bonam) filled with rice, jaggery, and curd on their heads as offerings to the goddess. The celebration features vibrant processions with traditional drumbeats, folk dances, and the famous Potharaju performance - men dressed as the goddess's brother dancing in a trance-like state. Devotees seek blessings for protection from diseases and evil forces. The festival includes the Rangam ceremony where oracles predict the future, and culminates with the Ghatam procession. Bonalu represents the feminine power and the protective nature of the Mother Goddess."
Mopin,State,Arunachal Pradesh,April,"Mopin is the most significant festival of the Galo tribe in Arunachal Pradesh, celebrating the arrival of spring and seeking prosperity from Mopin Ane, the goddess of wealth and prosperity. This five-day festival involves rituals to drive away evil spirits and diseases from the community. The celebration features traditional Galo dances, folk songs, and the consumption of rice beer called Apong. Young people perform the Popir dance, and elders conduct rituals for community welfare. The festival includes the decoration of homes with banana leaves, preparation of traditional delicacies, and community feasts. Mopin emphasizes unity, cultural preservation, and the harmonious relationship between humans and nature in Galo tradition."
Teeja,State,Chhattisgarh,July-August,"Teeja in Chhattisgarh is a monsoon festival celebrated by married women for the well-being and long life of their husbands. Similar to other regions but with unique Chhattisgarhi traditions, women observe fasts and pray to Lord Shiva and Goddess Parvati. The festival features traditional Chhattisgarhi folk songs, dances, and the preparation of special sweets and delicacies. Women wear traditional green and red sarees, apply henna, and swing on decorated jhulas hung from trees. The celebration includes community gatherings where women share stories, sing folk songs about marital life, and participate in traditional games. Teeja promotes sisterhood, cultural bonding, and celebrates the monsoon season's arrival."
Shigmo,State,Goa,March,"Shigmo is Goa's version of Holi, celebrated as a spring festival with unique Goan traditions blending Hindu customs with local culture. This festival spans over a fortnight and features vibrant street processions, folk dances, and cultural performances. The celebration includes traditional Goan folk dances like Ghode Modni (horse dance), Fugdi, and Dhalo performed by locals in colorful costumes. Villages organize parades with decorated floats depicting mythological themes and local legends. The festival culminates with the throwing of colors (gulal) and water. Traditional Goan cuisine, folk music, and community participation make Shigmo a celebration of Goan heritage, agricultural prosperity, and the triumph of good over evil."
Karma,State,Jharkhand,August-September,"Karma is a significant harvest festival celebrated by the tribal communities of Jharkhand, particularly the Oraon, Munda, and Ho tribes. The festival is dedicated to Karma Devta (the deity of power, youth, and youthfulness) and marks the end of the monsoon season. The celebration centers around the sacred Karma tree (Nauclea parvifolia), whose branches are ceremonially brought to the village and worshipped. Young men and women perform traditional Karma dance in circles around the Karma tree, accompanied by traditional drums like Mandar and Dhol. The festival includes fasting, preparation of traditional foods, and community bonding. Karma promotes environmental consciousness, celebrates nature's bounty, and preserves tribal cultural heritage through songs and dances."
Thrissur Pooram,State,Kerala,April-May,"Thrissur Pooram is often called the 'Festival of Festivals' in Kerala, held at the Vadakkunnathan Temple in Thrissur. This spectacular festival features a magnificent display of decorated elephants, traditional percussion ensembles, and fireworks. The highlight is the elephant procession with over 50 beautifully decorated elephants carrying ornate parasols, peacock feathers, and traditional ornaments. The celebration includes the famous Melam - traditional percussion music performed by hundreds of artists using instruments like chenda, maddalam, and kombu. The festival culminates with a grand fireworks display that lights up the night sky. Thrissur Pooram showcases Kerala's rich temple traditions, classical arts, and community participation, representing the cultural grandeur and artistic excellence of the state."
Lai Haraoba,State,Manipur,April-May,"Lai Haraoba is the oldest and most sacred festival of the Meitei community in Manipur, meaning 'merrymaking of the gods.' This ancient festival celebrates the creation myths and honors the local deities (Lai) of Manipur. The festival spans several days and features ritualistic dances that narrate the story of creation, performed by Maibas (priests) and Maibis (priestesses). The celebration includes traditional Manipuri classical dances, folk performances, and the reenactment of cosmic creation through dance-drama. Participants wear traditional Manipuri costumes and the performances are held at sacred groves and temples. The festival emphasizes spiritual purification, cultural preservation, and the connection between humans and divine forces. Lai Haraoba is considered the foundation of Manipuri dance and represents the state's ancient cultural heritage."
Kali Puja,State,Odisha,October-November,"Kali Puja in Odisha is a significant festival dedicated to Goddess Kali, celebrated with great devotion and unique regional traditions. Unlike the Bengali version, Odia Kali Puja has its own distinct rituals and customs. The festival involves elaborate decorations of Kali temples, special prayers, and offerings of hibiscus flowers, which are considered sacred to the goddess. Devotees perform traditional dances, sing devotional songs, and participate in night-long vigils. The celebration includes the preparation of special offerings like kheer, fruits, and sweets. Many temples organize cultural programs featuring Odissi dance performances and classical music concerts. The festival emphasizes the worship of Shakti (divine feminine power) and seeks protection from evil forces. Kali Puja represents the triumph of good over evil and showcases Odisha's rich devotional traditions."
Lohri,State,Punjab,January,"Lohri is a popular winter folk festival celebrated primarily in Punjab, marking the end of winter solstice and the beginning of longer days. This harvest festival celebrates the sugarcane harvest and is dedicated to Dulha Bhatti, a legendary figure. The celebration centers around a bonfire where people gather to sing traditional folk songs, perform Bhangra and Gidda dances, and throw offerings like sesame seeds, jaggery, and popcorn into the fire. Families prepare traditional foods like sarson da saag, makki di roti, gur, and peanuts. The festival promotes community bonding, gratitude for the harvest, and marks an auspicious time for new beginnings. Children go door-to-door singing Lohri songs and collecting treats."
Gangaur,State,Rajasthan,March-April,"Gangaur is one of the most important festivals for women in Rajasthan, dedicated to Goddess Gauri (Parvati) and Lord Shiva. This 18-day festival celebrates marital happiness and is observed by both married and unmarried women. The celebration involves beautifully decorated idols of Gauri and Isar (Shiva) carried in colorful processions through the streets. Women wear traditional Rajasthani attire, apply henna, and perform folk dances like Ghoomar. The festival includes the worship of clay idols, fasting, and the preparation of special sweets like ghevar and feeni. The processions feature traditional music, decorated camels, horses, and palanquins. Gangaur represents devotion, marital bliss, and showcases Rajasthan's vibrant culture and traditions."
Pang Lhabsol,State,Sikkim,August-September,"Pang Lhabsol is a unique festival celebrated in Sikkim to honor Mount Khangchendzonga, the guardian deity and protector of Sikkim. This festival involves traditional mask dances called Cham performed by monks at monasteries, particularly at Pemayangtse and Tashiding. The celebration includes prayers for the protection of Sikkim and its people from natural calamities and evil forces. Dancers wear elaborate masks representing various deities and demons, accompanied by traditional music played on long horns, drums, and cymbals. The festival also features the display of traditional weapons and the performance of warrior dances. Pang Lhabsol represents the spiritual bond between the people of Sikkim and their sacred mountain, promoting environmental consciousness and Buddhist philosophy."
Pongal,State,Tamil Nadu,January,"Pongal is the most important harvest festival in Tamil Nadu, celebrated over four days to honor the sun god, cattle, and nature. This festival marks the beginning of the sun's northward journey (Uttarayan) and celebrates the rice harvest. The highlight is the preparation of Pongal dish - sweet rice cooked with jaggery and milk in earthen pots, often boiling over as a symbol of prosperity. The celebration includes decorating homes with kolam (rangoli), decorating cattle with flowers and bells, and conducting Jallikattu (bull-taming sport). Each day has specific significance: Bhogi (cleaning), Thai Pongal (main celebration), Mattu Pongal (cattle worship), and Kaanum Pongal (family gathering). The festival represents gratitude to nature, agricultural prosperity, and Tamil cultural heritage."
Bonalu,State,Telangana,July-August,"Bonalu is a traditional Hindu festival celebrated in Telangana, dedicated to Goddess Mahakali. The festival involves women carrying decorated pots (bonam) filled with rice, jaggery, and curd on their heads as offerings to the goddess. The celebration features vibrant processions with traditional drumbeats, folk dances, and the famous Potharaju performance - men dressed as the goddess's brother dancing in a trance-like state. Devotees seek blessings for protection from diseases and evil forces. The festival includes the Rangam ceremony where oracles predict the future, and culminates with the Ghatam procession. Bonalu represents the feminine power and the protective nature of the Mother Goddess, showcasing Telangana's unique cultural identity."
Garia Puja,State,Tripura,April,"Garia Puja is a significant festival of the Tripuri tribal community, dedicated to Garia, the deity of livestock and vegetation. This festival marks the beginning of the new agricultural year and seeks blessings for good harvest and prosperity. The celebration involves the construction of a temporary bamboo temple where the Garia deity is worshipped with offerings of rice, fish, and local beverages. Traditional Tripuri dances like Garia dance are performed by men and women wearing colorful traditional costumes. The festival includes community feasts, folk songs narrating tribal legends, and various cultural competitions. Musical instruments like sumui (flute), kham (drum), and lebang are played during the celebrations. Garia Puja promotes tribal culture, agricultural practices, and community harmony."
Kartik Purnima,State,Uttar Pradesh,October-November,"Kartik Purnima is a significant Hindu festival celebrated across Uttar Pradesh, particularly famous for the grand celebrations at Varanasi and other holy cities along the Ganges. This festival marks the full moon day of the Kartik month and is considered highly auspicious for holy baths in sacred rivers. The celebration includes the lighting of thousands of diyas (oil lamps) along ghats, creating a mesmerizing spectacle. Devotees take holy dips in the Ganges, offer prayers, and perform Ganga aarti. The festival features boat processions, classical music concerts, and cultural performances. Special preparations include the Dev Deepavali celebration in Varanasi where the entire city is illuminated with oil lamps. Kartik Purnima represents spiritual purification, devotion, and the cultural richness of India's holy cities."
Egoss,State,Uttarakhand,August-September,"Egoss (also known as Egas) is a traditional festival celebrated in the Kumaon region of Uttarakhand, particularly by women to protect their families from evil spirits and diseases. This festival involves the creation of human effigies using dough, which are then decorated and worshipped before being discarded to drive away negative forces. Women gather in groups, sing traditional folk songs, and prepare special dishes using local ingredients. The celebration includes the worship of family deities and seeks protection for children and livestock. Traditional Kumaoni dances and songs are performed, often accompanied by instruments like dhol and damau. The festival emphasizes community bonding, cultural preservation, and the protective role of women in maintaining family welfare. Egoss represents the rich folk traditions of the Himalayan region."
Poila Boishakh,State,West Bengal,April,"Poila Boishakh marks the Bengali New Year and is celebrated with great enthusiasm throughout West Bengal. This festival signifies new beginnings and is observed with traditional rituals, cultural programs, and community celebrations. The day begins with prayers and offerings to deities, followed by the traditional practice of starting new account books by merchants. People wear new clothes, particularly traditional Bengali attire, and prepare special dishes like panta bhat (fermented rice), ilish fish, and various sweets. The celebration includes Mangal Shobhajatra (colorful processions), cultural performances featuring Rabindra Sangeet, folk dances, and recitation of poetry. Various cultural organizations organize fairs, exhibitions, and competitions. Poila Boishakh represents cultural pride, renewal of life, and the preservation of Bengali heritage and traditions."
